{
  "runVersion": "1.0",
  "runId": "task-run:d7c57685e7c52ac0c0cf5b5479eacc353a887873f09b066aea87e26baf9c5495",
  "task": {
    "taskId": "sha256:3c621ced615d86b4b1c9e8ea644b1045fd762b71675f5c82acc54737f9182670",
    "taskFileSha256": "sha256:9220e12596b83dbc1619f4859c54d2c3847b733b700818a50fb97aa88df3f8c7",
    "sourceRevision": "pattern-c-runtime-fixture-v1",
    "contractTreeSha256": "sha256:0e1e4d837256995597bcf684eb3a2c613df90918e21bfdf7e8f3998a8f5e554c",
    "runnerSnapshotBeforeSha256": "sha256:2f5a60bc694ee969c17914c85b53df4960565372eb274588e287a2715478b865",
    "runnerSnapshotFinalSha256": "sha256:2f5a60bc694ee969c17914c85b53df4960565372eb274588e287a2715478b865",
    "sourceUnchanged": true,
    "sourceFinalError": null,
    "trialId": "pattern-c-runtime-r01"
  },
  "agent": {
    "provider": "claude-code-2.1.185",
    "model": "sonnet alias (provider metadata recorded)",
    "argv": [
      "/Users/tangyaoyue/.hermes/node/bin/node",
      "/Users/tangyaoyue/DEV/sg-data-pack/research/agent-eval/providers/claude-patch-agent.js",
      "/var/folders/r0/2xc529t10dz2lk4749f0rh540000gn/T/sg-agent-task-T3JOxv/workspace",
      "/private/tmp/sg-agent-claude-final-release/trials/pattern-c-runtime-r01/agent.patch",
      "/private/tmp/sg-agent-claude-final-release/trials/pattern-c-runtime-r01/TASK.md"
    ],
    "cwd": "/private/var/folders/r0/2xc529t10dz2lk4749f0rh540000gn/T/sg-agent-task-T3JOxv/workspace",
    "exitCode": 0,
    "signal": null,
    "timedOut": false,
    "durationMs": 231543.67,
    "stdoutSha256": "sha256:6c00198a6a0ef0c816deb24640f3124967218fb8d682e8cef6d6b1a8f2d9de09",
    "stderrSha256": "sha256:e3b0c44298fc1c149afbf4c8996fb92427ae41e4649b934ca495991b7852b855",
    "stdout": "{\"provider\":\"claude-code\",\"declaredModel\":\"sonnet\",\"modelUsage\":{\"MiniMax-M3[1M]\":{\"inputTokens\":2443,\"outputTokens\":19966,\"cacheReadInputTokens\":128,\"cacheCreationInputTokens\":0,\"webSearchRequests\":0,\"costUSD\":0.511429,\"contextWindow\":1000000,\"maxOutputTokens\":32000}},\"usage\":{\"input_tokens\":2443,\"cache_creation_input_tokens\":0,\"cache_read_input_tokens\":128,\"output_tokens\":19966,\"server_tool_use\":{\"web_search_requests\":0,\"web_fetch_requests\":0},\"service_tier\":\"standard\",\"cache_creation\":{\"ephemeral_1h_input_tokens\":0,\"ephemeral_5m_input_tokens\":0},\"inference_geo\":\"\",\"iterations\":[],\"speed\":\"standard\"},\"totalCostUsd\":0.511429,\"durationApiMs\":231215,\"stopReason\":\"end_turn\",\"permissionDenials\":[]}\n",
    "stderr": "",
    "stdoutTruncated": false,
    "stderrTruncated": false,
    "error": null,
    "providerMetadata": {
      "provider": "claude-code",
      "declaredModel": "sonnet",
      "modelUsage": {
        "MiniMax-M3[1M]": {
          "inputTokens": 2443,
          "outputTokens": 19966,
          "cacheReadInputTokens": 128,
          "cacheCreationInputTokens": 0,
          "webSearchRequests": 0,
          "costUSD": 0.511429,
          "contextWindow": 1000000,
          "maxOutputTokens": 32000
        }
      },
      "usage": {
        "input_tokens": 2443,
        "cache_creation_input_tokens": 0,
        "cache_read_input_tokens": 128,
        "output_tokens": 19966,
        "server_tool_use": {
          "web_search_requests": 0,
          "web_fetch_requests": 0
        },
        "service_tier": "standard",
        "cache_creation": {
          "ephemeral_1h_input_tokens": 0,
          "ephemeral_5m_input_tokens": 0
        },
        "inference_geo": "",
        "iterations": [],
        "speed": "standard"
      },
      "totalCostUsd": 0.511429,
      "durationApiMs": 231215,
      "stopReason": "end_turn",
      "permissionDenials": []
    }
  },
  "patch": {
    "auditVersion": "1.0",
    "auditId": "patch-audit:7d65facd435834371e9a0a14897f625ff8b9b3c4d0e51f464cf0ae3d016c659b",
    "kind": "patch-audit",
    "taskId": "sha256:3c621ced615d86b4b1c9e8ea644b1045fd762b71675f5c82acc54737f9182670",
    "status": "rejected",
    "patchSha256": "sha256:770dcba500dd445b1ee43e2717686d3ef2fbd57756a26d347f9c4104a2b991c3",
    "patchBytes": 2461,
    "beforeTreeSha256": "sha256:2f5a60bc694ee969c17914c85b53df4960565372eb274588e287a2715478b865",
    "afterTreeSha256": null,
    "declaredOperations": [
      {
        "operation": "modify",
        "path": "lib/data/data.js",
        "hunks": 1,
        "modes": {},
        "policy": {
          "allowed": true,
          "reason": null,
          "deniedBy": null,
          "allowedBy": "lib/data/data.js"
        }
      },
      {
        "operation": "modify",
        "path": "lib/data/data.json",
        "hunks": 4,
        "modes": {},
        "policy": {
          "allowed": true,
          "reason": null,
          "deniedBy": null,
          "allowedBy": "lib/data/data.json"
        }
      }
    ],
    "actualOperations": [],
    "preflight": {
      "allowed": true,
      "violations": []
    },
    "postflight": null,
    "commands": {
      "check": {
        "argv": [
          "git",
          "apply",
          "--check",
          "--whitespace=error-all",
          "/var/folders/r0/2xc529t10dz2lk4749f0rh540000gn/T/sg-agent-patch-83564-1785574435828-e4a2bdeb6ab5a.diff"
        ],
        "cwd": "/private/var/folders/r0/2xc529t10dz2lk4749f0rh540000gn/T/sg-agent-task-T3JOxv/workspace",
        "exitCode": 128,
        "signal": null,
        "timedOut": false,
        "durationMs": 21.056834,
        "stdoutSha256": "sha256:e3b0c44298fc1c149afbf4c8996fb92427ae41e4649b934ca495991b7852b855",
        "stderrSha256": "sha256:8eb5fb3f1054381643c3673f6e5fa294934f64c17fbd0817aab44c6b4aacb205",
        "error": null
      },
      "apply": null
    },
    "failure": {
      "kind": "patch-invalid",
      "name": "PatchError",
      "message": "git apply --check rejected the patch",
      "details": {
        "checkRun": {
          "argv": [
            "git",
            "apply",
            "--check",
            "--whitespace=error-all",
            "/var/folders/r0/2xc529t10dz2lk4749f0rh540000gn/T/sg-agent-patch-83564-1785574435828-e4a2bdeb6ab5a.diff"
          ],
          "cwd": "/private/var/folders/r0/2xc529t10dz2lk4749f0rh540000gn/T/sg-agent-task-T3JOxv/workspace",
          "status": 128,
          "exitCode": 128,
          "exit": 128,
          "signal": null,
          "timedOut": false,
          "durationMs": 21.056834,
          "duration": 21.056834,
          "stdout": "",
          "stderr": "error: corrupt patch at line 24\n",
          "stdoutTruncated": false,
          "stderrTruncated": false,
          "truncated": false
        }
      }
    },
    "capabilities": {
      "osSandbox": false,
      "networkIsolation": false,
      "processIsolation": false,
      "sourceTreeVerifiedByRunner": true,
      "disposableWorkspace": true
    }
  },
  "grades": [],
  "secondaryErrors": [],
  "artifacts": [
    {
      "id": "agent-patch",
      "path": "agent.patch",
      "mediaType": "text/x-diff",
      "bytes": 2461,
      "sha256": "sha256:770dcba500dd445b1ee43e2717686d3ef2fbd57756a26d347f9c4104a2b991c3"
    },
    {
      "id": "patch-audit",
      "path": "patch-audit.json",
      "mediaType": "application/json",
      "bytes": 2915,
      "sha256": "sha256:0cb4a082fe4af344ddebcb1253adadc46b85f545bbb4a60b1e882d97140bdefc"
    },
    {
      "id": "task-prompt",
      "path": "TASK.md",
      "mediaType": "text/markdown",
      "bytes": 368,
      "sha256": "sha256:8d6d410df008eb20405838885369f435267b07b38267305d013cd4661c971d29"
    }
  ],
  "verdict": "patch-invalid",
  "termination": {
    "kind": "completed",
    "processExitCode": 1,
    "semanticVerdict": "patch-invalid",
    "message": "git apply --check rejected the patch"
  },
  "capabilities": {
    "sourceCopy": true,
    "disposableWorkspace": true,
    "completeSecuritySnapshots": true,
    "postAgentSourceTreeCheck": true,
    "postPatchTreePolicy": true,
    "postGraderTreeCheck": true,
    "verifiedGraderStaging": true,
    "verifiedToolStaging": true,
    "candidateExtractionWorker": true,
    "osSandbox": false,
    "filesystemIsolation": false,
    "networkIsolation": false,
    "processIsolation": false,
    "maliciousAgentGraderSecrecy": false
  }
}
