{
  "runVersion": "1.0",
  "runId": "task-run:f198854b1a316d4f255f970c87ed2763e7938159828a18d060c647a0abcfecad",
  "task": {
    "taskId": "sha256:295709a674170fcf6188e9ae793fbd2f42e8f57c95287f3fc27a0e5556f1e118",
    "taskFileSha256": "sha256:ac33ff5e0049324b56141ea0687442ed5e344fb6305390f8257b02f2cd17a630",
    "sourceRevision": "alias-relation-fixture-v1",
    "contractTreeSha256": "sha256:fffbe5c6cd3b100ea754dfc73b72bb75adae0ccd8ca789fb18c00ed68b2cfc53",
    "runnerSnapshotBeforeSha256": "sha256:6243526415fa11e029c8205e3ee3ddb2f0cb824e7e561c733480c3c8ecabb6c5",
    "runnerSnapshotFinalSha256": "sha256:6243526415fa11e029c8205e3ee3ddb2f0cb824e7e561c733480c3c8ecabb6c5",
    "sourceUnchanged": true,
    "sourceFinalError": null,
    "trialId": "alias-relation-r03"
  },
  "agent": {
    "provider": "claude-code-2.1.185",
    "model": "sonnet alias (provider metadata recorded)",
    "argv": [
      "/Users/tangyaoyue/.hermes/node/bin/node",
      "/Users/tangyaoyue/DEV/sg-data-pack/research/agent-eval/providers/claude-patch-agent.js",
      "/var/folders/r0/2xc529t10dz2lk4749f0rh540000gn/T/sg-agent-task-omgCH1/workspace",
      "/private/tmp/sg-agent-claude-final-release/trials/alias-relation-r03/agent.patch",
      "/private/tmp/sg-agent-claude-final-release/trials/alias-relation-r03/TASK.md"
    ],
    "cwd": "/private/var/folders/r0/2xc529t10dz2lk4749f0rh540000gn/T/sg-agent-task-omgCH1/workspace",
    "exitCode": 0,
    "signal": null,
    "timedOut": false,
    "durationMs": 9756.787833,
    "stdoutSha256": "sha256:098f72c2bbfbb00bd46948c47302c3b8ea6823c748f35998091cfaf6c609d9a2",
    "stderrSha256": "sha256:e3b0c44298fc1c149afbf4c8996fb92427ae41e4649b934ca495991b7852b855",
    "stdout": "{\"provider\":\"claude-code\",\"declaredModel\":\"sonnet\",\"modelUsage\":{\"MiniMax-M3[1M]\":{\"inputTokens\":1285,\"outputTokens\":454,\"cacheReadInputTokens\":128,\"cacheCreationInputTokens\":0,\"webSearchRequests\":0,\"costUSD\":0.017839,\"contextWindow\":1000000,\"maxOutputTokens\":32000}},\"usage\":{\"input_tokens\":1285,\"cache_creation_input_tokens\":0,\"cache_read_input_tokens\":128,\"output_tokens\":454,\"server_tool_use\":{\"web_search_requests\":0,\"web_fetch_requests\":0},\"service_tier\":\"standard\",\"cache_creation\":{\"ephemeral_1h_input_tokens\":0,\"ephemeral_5m_input_tokens\":0},\"inference_geo\":\"\",\"iterations\":[],\"speed\":\"standard\"},\"totalCostUsd\":0.017839,\"durationApiMs\":8821,\"stopReason\":\"end_turn\",\"permissionDenials\":[]}\n",
    "stderr": "",
    "stdoutTruncated": false,
    "stderrTruncated": false,
    "error": null,
    "providerMetadata": {
      "provider": "claude-code",
      "declaredModel": "sonnet",
      "modelUsage": {
        "MiniMax-M3[1M]": {
          "inputTokens": 1285,
          "outputTokens": 454,
          "cacheReadInputTokens": 128,
          "cacheCreationInputTokens": 0,
          "webSearchRequests": 0,
          "costUSD": 0.017839,
          "contextWindow": 1000000,
          "maxOutputTokens": 32000
        }
      },
      "usage": {
        "input_tokens": 1285,
        "cache_creation_input_tokens": 0,
        "cache_read_input_tokens": 128,
        "output_tokens": 454,
        "server_tool_use": {
          "web_search_requests": 0,
          "web_fetch_requests": 0
        },
        "service_tier": "standard",
        "cache_creation": {
          "ephemeral_1h_input_tokens": 0,
          "ephemeral_5m_input_tokens": 0
        },
        "inference_geo": "",
        "iterations": [],
        "speed": "standard"
      },
      "totalCostUsd": 0.017839,
      "durationApiMs": 8821,
      "stopReason": "end_turn",
      "permissionDenials": []
    }
  },
  "patch": {
    "auditVersion": "1.0",
    "auditId": "patch-audit:3d130ebe764c4a36cf67102e04a369f1e56cce7141353b97109c3706b04d87d7",
    "kind": "patch-audit",
    "taskId": "sha256:295709a674170fcf6188e9ae793fbd2f42e8f57c95287f3fc27a0e5556f1e118",
    "status": "rejected",
    "patchSha256": "sha256:5d251043d5b64a4c55b9677c59c4d99f0d343140a638738fe3f27741f1195e9c",
    "patchBytes": 489,
    "beforeTreeSha256": "sha256:6243526415fa11e029c8205e3ee3ddb2f0cb824e7e561c733480c3c8ecabb6c5",
    "afterTreeSha256": null,
    "declaredOperations": [
      {
        "operation": "modify",
        "path": "lib/data/data.json",
        "hunks": 1,
        "modes": {},
        "policy": {
          "allowed": true,
          "reason": null,
          "deniedBy": null,
          "allowedBy": "lib/data/data.json"
        }
      }
    ],
    "actualOperations": [],
    "preflight": {
      "allowed": true,
      "violations": []
    },
    "postflight": null,
    "commands": {
      "check": {
        "argv": [
          "git",
          "apply",
          "--check",
          "--whitespace=error-all",
          "/var/folders/r0/2xc529t10dz2lk4749f0rh540000gn/T/sg-agent-patch-83564-1785574024447-85bba020679ec.diff"
        ],
        "cwd": "/private/var/folders/r0/2xc529t10dz2lk4749f0rh540000gn/T/sg-agent-task-omgCH1/workspace",
        "exitCode": 1,
        "signal": null,
        "timedOut": false,
        "durationMs": 33.42575,
        "stdoutSha256": "sha256:e3b0c44298fc1c149afbf4c8996fb92427ae41e4649b934ca495991b7852b855",
        "stderrSha256": "sha256:8e43234eaee96c9af409afb02af9666486ade6b792af89b79edf8a553711bc25",
        "error": null
      },
      "apply": null
    },
    "failure": {
      "kind": "patch-invalid",
      "name": "PatchError",
      "message": "git apply --check rejected the patch",
      "details": {
        "checkRun": {
          "argv": [
            "git",
            "apply",
            "--check",
            "--whitespace=error-all",
            "/var/folders/r0/2xc529t10dz2lk4749f0rh540000gn/T/sg-agent-patch-83564-1785574024447-85bba020679ec.diff"
          ],
          "cwd": "/private/var/folders/r0/2xc529t10dz2lk4749f0rh540000gn/T/sg-agent-task-omgCH1/workspace",
          "status": 1,
          "exitCode": 1,
          "exit": 1,
          "signal": null,
          "timedOut": false,
          "durationMs": 33.42575,
          "duration": 33.42575,
          "stdout": "",
          "stderr": "error: patch failed: lib/data/data.json:11\nerror: lib/data/data.json: patch does not apply\n",
          "stdoutTruncated": false,
          "stderrTruncated": false,
          "truncated": false
        }
      }
    },
    "capabilities": {
      "osSandbox": false,
      "networkIsolation": false,
      "processIsolation": false,
      "sourceTreeVerifiedByRunner": true,
      "disposableWorkspace": true
    }
  },
  "grades": [],
  "secondaryErrors": [],
  "artifacts": [
    {
      "id": "agent-patch",
      "path": "agent.patch",
      "mediaType": "text/x-diff",
      "bytes": 489,
      "sha256": "sha256:5d251043d5b64a4c55b9677c59c4d99f0d343140a638738fe3f27741f1195e9c"
    },
    {
      "id": "patch-audit",
      "path": "patch-audit.json",
      "mediaType": "application/json",
      "bytes": 2709,
      "sha256": "sha256:e70b0f179c783daca4003ccd3c44b89aa7818108c6e0423d21a35d99f5db3ab6"
    },
    {
      "id": "task-prompt",
      "path": "TASK.md",
      "mediaType": "text/markdown",
      "bytes": 265,
      "sha256": "sha256:a48c9c13252c885c6d147c5a877a8848442d2f66289648a6a48540ec686b8f9e"
    }
  ],
  "verdict": "patch-invalid",
  "termination": {
    "kind": "completed",
    "processExitCode": 1,
    "semanticVerdict": "patch-invalid",
    "message": "git apply --check rejected the patch"
  },
  "capabilities": {
    "sourceCopy": true,
    "disposableWorkspace": true,
    "completeSecuritySnapshots": true,
    "postAgentSourceTreeCheck": true,
    "postPatchTreePolicy": true,
    "postGraderTreeCheck": true,
    "verifiedGraderStaging": true,
    "verifiedToolStaging": true,
    "candidateExtractionWorker": true,
    "osSandbox": false,
    "filesystemIsolation": false,
    "networkIsolation": false,
    "processIsolation": false,
    "maliciousAgentGraderSecrecy": false
  }
}
