{
  "runVersion": "1.0",
  "runId": "task-run:309918a0fb60925f85b679ec333015c77b33eec76d0030b7dcdb9624b5ea525b",
  "task": {
    "taskId": "sha256:618930ecee265100be229a2d2efa73e733f70c7131e00b0ed7a4bbb8ba75a18f",
    "taskFileSha256": "sha256:27b37bf28fd1fcd4e0d160caef426afbaf27f9a4258e3e92b7795609b249798a",
    "sourceRevision": "field-update-fixture-v1",
    "contractTreeSha256": "sha256:5f3c536db01e9f4c2c1dbaabf9216bb532afc6f067ea18a7d13d89255105b35a",
    "runnerSnapshotBeforeSha256": "sha256:793d34d30db2b23ad60b518e1ef2ba63af8a1731be03baa813eb0a5730bbf76e",
    "runnerSnapshotFinalSha256": "sha256:793d34d30db2b23ad60b518e1ef2ba63af8a1731be03baa813eb0a5730bbf76e",
    "sourceUnchanged": true,
    "sourceFinalError": null,
    "trialId": "field-update-r02"
  },
  "agent": {
    "provider": "claude-code-2.1.185",
    "model": "sonnet alias (provider metadata recorded)",
    "argv": [
      "/Users/tangyaoyue/.hermes/node/bin/node",
      "/Users/tangyaoyue/DEV/sg-data-pack/research/agent-eval/providers/claude-patch-agent.js",
      "/var/folders/r0/2xc529t10dz2lk4749f0rh540000gn/T/sg-agent-task-j3ZSMo/workspace",
      "/private/tmp/sg-agent-claude-final-release/trials/field-update-r02/agent.patch",
      "/private/tmp/sg-agent-claude-final-release/trials/field-update-r02/TASK.md"
    ],
    "cwd": "/private/var/folders/r0/2xc529t10dz2lk4749f0rh540000gn/T/sg-agent-task-j3ZSMo/workspace",
    "exitCode": 0,
    "signal": null,
    "timedOut": false,
    "durationMs": 2788.293459,
    "stdoutSha256": "sha256:debaf11137c9c8e5b17bfec14924d1f095c95e5979552694a6386c1481f9a1ac",
    "stderrSha256": "sha256:e3b0c44298fc1c149afbf4c8996fb92427ae41e4649b934ca495991b7852b855",
    "stdout": "{\"provider\":\"claude-code\",\"declaredModel\":\"sonnet\",\"modelUsage\":{\"MiniMax-M3[1M]\":{\"inputTokens\":1205,\"outputTokens\":167,\"cacheReadInputTokens\":128,\"cacheCreationInputTokens\":0,\"webSearchRequests\":0,\"costUSD\":0.010263999999999999,\"contextWindow\":1000000,\"maxOutputTokens\":32000}},\"usage\":{\"input_tokens\":1205,\"cache_creation_input_tokens\":0,\"cache_read_input_tokens\":128,\"output_tokens\":167,\"server_tool_use\":{\"web_search_requests\":0,\"web_fetch_requests\":0},\"service_tier\":\"standard\",\"cache_creation\":{\"ephemeral_1h_input_tokens\":0,\"ephemeral_5m_input_tokens\":0},\"inference_geo\":\"\",\"iterations\":[],\"speed\":\"standard\"},\"totalCostUsd\":0.010263999999999999,\"durationApiMs\":2453,\"stopReason\":\"end_turn\",\"permissionDenials\":[]}\n",
    "stderr": "",
    "stdoutTruncated": false,
    "stderrTruncated": false,
    "error": null,
    "providerMetadata": {
      "provider": "claude-code",
      "declaredModel": "sonnet",
      "modelUsage": {
        "MiniMax-M3[1M]": {
          "inputTokens": 1205,
          "outputTokens": 167,
          "cacheReadInputTokens": 128,
          "cacheCreationInputTokens": 0,
          "webSearchRequests": 0,
          "costUSD": 0.010263999999999999,
          "contextWindow": 1000000,
          "maxOutputTokens": 32000
        }
      },
      "usage": {
        "input_tokens": 1205,
        "cache_creation_input_tokens": 0,
        "cache_read_input_tokens": 128,
        "output_tokens": 167,
        "server_tool_use": {
          "web_search_requests": 0,
          "web_fetch_requests": 0
        },
        "service_tier": "standard",
        "cache_creation": {
          "ephemeral_1h_input_tokens": 0,
          "ephemeral_5m_input_tokens": 0
        },
        "inference_geo": "",
        "iterations": [],
        "speed": "standard"
      },
      "totalCostUsd": 0.010263999999999999,
      "durationApiMs": 2453,
      "stopReason": "end_turn",
      "permissionDenials": []
    }
  },
  "patch": {
    "auditVersion": "1.0",
    "auditId": "patch-audit:cf9968dd9d7faa59142cf473b9195d1e61e72b1ea00b42cf2d3767993c8ce3d6",
    "kind": "patch-audit",
    "taskId": "sha256:618930ecee265100be229a2d2efa73e733f70c7131e00b0ed7a4bbb8ba75a18f",
    "status": "rejected",
    "patchSha256": "sha256:fee82b559e7b8e1ab73aed52cd41db243dd6d345d8bff06296242260baf2c882",
    "patchBytes": 263,
    "beforeTreeSha256": "sha256:793d34d30db2b23ad60b518e1ef2ba63af8a1731be03baa813eb0a5730bbf76e",
    "afterTreeSha256": null,
    "declaredOperations": [
      {
        "operation": "modify",
        "path": "lib/data/data.json",
        "hunks": 1,
        "modes": {},
        "policy": {
          "allowed": true,
          "reason": null,
          "deniedBy": null,
          "allowedBy": "lib/data/data.json"
        }
      }
    ],
    "actualOperations": [],
    "preflight": {
      "allowed": true,
      "violations": []
    },
    "postflight": null,
    "commands": {
      "check": {
        "argv": [
          "git",
          "apply",
          "--check",
          "--whitespace=error-all",
          "/var/folders/r0/2xc529t10dz2lk4749f0rh540000gn/T/sg-agent-patch-83564-1785573846312-e650bd822cd15.diff"
        ],
        "cwd": "/private/var/folders/r0/2xc529t10dz2lk4749f0rh540000gn/T/sg-agent-task-j3ZSMo/workspace",
        "exitCode": 128,
        "signal": null,
        "timedOut": false,
        "durationMs": 14.829958,
        "stdoutSha256": "sha256:e3b0c44298fc1c149afbf4c8996fb92427ae41e4649b934ca495991b7852b855",
        "stderrSha256": "sha256:a605710393416cbb2aeaaf05e61e89ae5bd80941edf6faff1444c7d98e996285",
        "error": null
      },
      "apply": null
    },
    "failure": {
      "kind": "patch-invalid",
      "name": "PatchError",
      "message": "git apply --check rejected the patch",
      "details": {
        "checkRun": {
          "argv": [
            "git",
            "apply",
            "--check",
            "--whitespace=error-all",
            "/var/folders/r0/2xc529t10dz2lk4749f0rh540000gn/T/sg-agent-patch-83564-1785573846312-e650bd822cd15.diff"
          ],
          "cwd": "/private/var/folders/r0/2xc529t10dz2lk4749f0rh540000gn/T/sg-agent-task-j3ZSMo/workspace",
          "status": 128,
          "exitCode": 128,
          "exit": 128,
          "signal": null,
          "timedOut": false,
          "durationMs": 14.829958,
          "duration": 14.829958,
          "stdout": "",
          "stderr": "error: corrupt patch at line 12\n",
          "stdoutTruncated": false,
          "stderrTruncated": false,
          "truncated": false
        }
      }
    },
    "capabilities": {
      "osSandbox": false,
      "networkIsolation": false,
      "processIsolation": false,
      "sourceTreeVerifiedByRunner": true,
      "disposableWorkspace": true
    }
  },
  "grades": [],
  "secondaryErrors": [],
  "artifacts": [
    {
      "id": "agent-patch",
      "path": "agent.patch",
      "mediaType": "text/x-diff",
      "bytes": 263,
      "sha256": "sha256:fee82b559e7b8e1ab73aed52cd41db243dd6d345d8bff06296242260baf2c882"
    },
    {
      "id": "patch-audit",
      "path": "patch-audit.json",
      "mediaType": "application/json",
      "bytes": 2660,
      "sha256": "sha256:c99a0a726c360e331267def9b9695dbbfaa6dd17c82617cfaa553537e426f63a"
    },
    {
      "id": "task-prompt",
      "path": "TASK.md",
      "mediaType": "text/markdown",
      "bytes": 187,
      "sha256": "sha256:21f3f361c74972d195f556886659d9f83a5f002e17ea3ad0dd8bc004a46d7e62"
    }
  ],
  "verdict": "patch-invalid",
  "termination": {
    "kind": "completed",
    "processExitCode": 1,
    "semanticVerdict": "patch-invalid",
    "message": "git apply --check rejected the patch"
  },
  "capabilities": {
    "sourceCopy": true,
    "disposableWorkspace": true,
    "completeSecuritySnapshots": true,
    "postAgentSourceTreeCheck": true,
    "postPatchTreePolicy": true,
    "postGraderTreeCheck": true,
    "verifiedGraderStaging": true,
    "verifiedToolStaging": true,
    "candidateExtractionWorker": true,
    "osSandbox": false,
    "filesystemIsolation": false,
    "networkIsolation": false,
    "processIsolation": false,
    "maliciousAgentGraderSecrecy": false
  }
}
